Susceptibility study,"Investigating the susceptibility of white-footed mice (Peromyscus leucopus), rats (rattus rattus), and prairie dogs to 2022 mpox virus infection",Epidemiology,CDC,USA,Ongoing (new activity by program as result of current outbreak),"Q2 2023: The Peromyscus study has been completed and sample processing and laboratory testing has begun.

2023 Q3: Rattus rattus and prairie dog studies will begin",2024,This study examines the pathogenesis of multiple mpox virus strains in domestic wild animals and will yield data about whether or not these rodents could become a potential mpox virus host in North America.,
Viral persistence,Identify persistence of mpox virus in bodily fluids,Epidemiology,CDC,USA (Puerto Rico and New York City),Q1 2023 Will start enrollment late March 2023,Just started,Q4 2023 (1 year project),"These projects investigate viral persistence in semen and other body fluids. Project data on the effect of mpox virus on sperm count, concentration, motility, or morphology post-infection could enable informed decisions about reproductive health.  The project in partnership with Puerto Rico and Columbia University involves multiple sites using a common approach and protocol. 

The  study will involve collection of serial specimens from confirmed and probable male mpox cases post-diagnosis to: 1) Determine the presence, persistence, or recurrence of mpox virus in seminal fluid, saliva, conjunctival fluid, oropharyngeal swabs, and rectal swabs, and whether it is replication competent, 2) Describe orthopoxvirus antibody response in blood, 3) Characterize changes in sperm count, motility, or quality in the convalescent phase, and 4) Characterize psychosocial, behavioral and clinical sequelae from mpox illness over time.",
Transmission Dynamics and Modes,"Ecological and Epidemiological Investigations of High-Consequence Zoonotic Pathogens at the Livestock, Wildlife and Human Interface",Epidemiology,USDA Agricultural Research Service,TBD,Planned,2022 Q4: Initiate study,TBD,"Domestic and wild animals will be monitored for evidence of mpox infection to better understand whether animals play a role in harboring, transmitting, or persistence of the virus. In collaboration with Institut National de Recherche Biomédicale (INRB), and the Institute of Tropical Medicine Antwerp (ITM) we will explore evidence of spillover in the Democratic Republic of Congo and in border areas with Angola and Uganda. These groups have established study locations in areas where mpox cases are frequently observed.  In addition, we will partner with UCLA and NIH Rocky Mountain Laboratories for analysis of samples collected in the Republic of Congo including border areas. Samples will be assessed for evidence of antibodies to orthopox virus as well as the presence of viral DNA as well as live virus if lesions are present in any collected animals.",
Transmission Dynamics and Modes,Evaluation of susceptibility of select animal species.,Epidemiology,USDA Agricultural Research Service,TBD,Planned,2022 Q4: Initiate study,TBD,"As the mpox virus continues to spread, there is the potential for the virus to become established in animal populations through contact with infected humans or environments, so the susceptibility of various animal species to infection will be assessed.  Determine the potential risk of transmission of mpox virus to animals including domestic (agricultural, companion), peri-domestic animals (e.g. rodents), and wildlife.",
Serosurveys and Improved Serological Surveys,Development of a mpoxspecific immunoassay,Epidemiology,USDA Agricultural Research Service,TBD,Planned,2022 Q4: Initiate study,TBD,"Testing methods to distinguish whether an animal or person has been exposed to Mpox or another virus in the same virus family will be developed. Identify specific peptides / protein fragments (encoded or absent in MPXV genome) that would allow differentiation of mpox infection from vaccination and previous smallpox or other orthopox virus infection. Currently available assays are only able to distinguish if a person / animal has been exposed to an orthopox infection. Assays cannot distinguish if the response was the result of a mpox infection or another orthopox virus infection. 

If specific peptides/protein fragments are identified, USDA and Columbia University will partner with CDC to develop a mpox specific assay.",
Biosurveillance study,Mpox Threat Reduction Network (MPX-TRN): Using the Sentinel Sites in the DRC as a regional training center to create sustainable biosurveillance systems in DTRA Priority Countries,Epidemiology,DTRA-CTR/BTRP,"International: Democratic Republic of Congo, Uganda, Cameroon",Ongoing,Initiate sample testing and MPV genome sequencing; Establish training center,Base period ends: 2024 Q3,"This study aims to determine the incidence, distribution, and transmission chain of mpox virus in the region and strengthen capacities for case detection, biosurveillance, and laboratory diagnostics in order to create a sustainable biosurveillance system.",
Education and Training,Sample Collection Training and Capacity Building,Education,WRAIR,International: West Africa,Closing out both training iterations,"2022 Q4: Manuscript, documenting the training approach and associated outcomes, journal submission is on-going",2023 Q3,"WRAIR, through the Joint West African Research Group, facilitated training for personnel to identify potential infected patients and collect mpox samples for diagnostic testing. This builds capacity for early identification of mpox in areas with endemic disease and/or reservoirs, where spillover to humans is most likely to occur.",
International Training and equipment upgrades/maintenance,Enhancing Biosafety and Biosecurity of High Containment Facilities at the Institut National de Recherche Biomédicale (INRB),Education,DOS/ISN,International: DRC,Ongoing,In-person workshop in October 2022,2022 Q4,"Through a series of virtual biosafety and biosecurity trainings participants will be trained on biorisk management and will develop an institutional biosafety and biosecurity program plan. This effort will build institutionalized capacity at the INRB to ensure that equipment in laboratories working with and storing high-consequence pathogens, such as mpox virus, is operating optimally and with all necessary biosafety and biosecurity considerations.",
Computational and Bioinformatics support; Outreach and Communication Activities,Computational and bioinformatics support for the mpox virus research community (BV-BRC),Outreach,NIH/NIAID/NLM,Domestic and International,Ongoing,,"2023 Q1
and ongoing","The BV-BRC provided and extended public access to computational platforms and analysis tools to accelerate large-scale data analysis capabilities needed to monitor and assess countermeasures against monkeypox virus. During 2022 updated mpox genome annotations and orthopoxvirus analytic tools were extended in collaboration with experts of the International Committee on Taxonomy of Viruses (ICTV).  In collaboration with the BRCs, NIH/NLM, orthopoxvirus stakeholders, and the University of California Santa Cruz (UCSC) the UCSC Genome Browser mpox virus reference genome browser was launched. Furthermore, the BV-BRC hosted the Mpox and Orthopoxvirus Mini-Symposium on bioinformatics resources, tools, and research for the research community, bringing together nearly 800 registrants with 478 attendees from over 40 countries.",https://www.bv-brc.org/
