Observational Study,"Observational studies to understand epidemiological characteristics, changing demographics over time, clinical course of illness, novel transmission routes, and transmission dynamics",Epidemiology,CDC,Domestic,Ongoing; case form data analyzed weekly; serosurveys in select communities underway,"2022 Q3: Complete sample collection 

2022 Q4: Results from serologies studies complete;

2023 Q1: Publish results of investigating cases reported in special populations; collecting data for in-depth exposure assessment among mpox cases with no reported male-male sexual contact in select health departments",2022 Q4,"CDC will investigate cases reported in special populations and with novel transmission routes by collecting and analyzing case report form data; investigate unusual cases (e.g., pediatrics, women, pregnant people); solicitation of electronic health care data resources to monitor health care utilization, and collection of additional exposure data in cases of mpox with no reported male-male sexual contact. These studies allow investigators to understand who is at risk for infection, how the virus is being transmitted, whether the outbreak is slowing or gaining momentum, and importantly, where interventions are likely to have the greatest impact in halting the spread of the virus. Case report form data are being analyzed weekly.",
Observational Study,Two retrospective seroprevalence surveys in the United States,Epidemiology,CDC,Domestic,"Ongoing laboratory work is complete, analysis ongoing",2023 Q2: Complete laboratory testing and publish results,2023 Q2,Investigate mpox virus infection occurring in the U.S. prior to earliest cases detected.  CDC will assess the prevalence of poxvirus antibodies retrospectively in serum collected during two different studies in select communities. The two studies are MWCCS (form Johns Hopkins University) and Doxy PEAP (from University of Washington). The testing of initial time points are completed. Testing for additional samples are ongoing.,
Serologic assay development,High-throughput serologic assay to distinguish between prior mpox infection and prior receipt of vaccinia-based vaccine,Epidemiology,NIH/NIAID,Domestic,Ongoing,,Ongoing,"NIAID scientists from the PREMISE initiative at the Vaccine Research Center (VRC) are developing a high throughput serologic assay that can distinguish between individuals who have been infected with mpox versus individuals who may have received a vaccinia-based vaccine, such as JYNNEOS or ACAM2000.  NIAID will use this approach in collaboration with national and international researchers, including the Centers for Disease Control and Prevention to conduct retrospective and prospective serological studies to better understand the extent of mpox virus circulation in the United States and worldwide.",https://www.niaid.nih.gov/research/premise
Virulence Potential Study,Evaluating the virulence of contemporary isolates with historical isolates,Epidemiology,NIH/NIAID,Domestic,Ongoing,"2023 Q1: Results published. Americo, J. L., et al. (2023). ""Virulence differences of mpox (monkeypox) virus clades I, IIa, and IIb.1 in a small animal model."" Proc Natl Acad Sci U S A 120(8): e2220415120.",2022 Q4,This study compares virulence of the 2022 mpox strains compared to historical West African isolates. This research will deepen knowledge of the virulence of different mpox virus clades and will investigate the genetic contributions to those differences.,
Transmission Study,Exploration of fomite and aerosol survival and spread,Epidemiology,NIH/NIAID,Domestic,Ongoing,2022 Q3: Results expected manuscript in progress,2022 Q3,"Efforts include survival of mpox virus on fomites and in aerosols, and establishment of small animal models to study transmission dynamics. Data from these studies will inform infection prevention and control efforts in the US and globally.",
Human-Animal Interface Study,"CDC diagnostic laboratory support for mpox in animals for state and local jurisdictions to test submitted animal samples, both domestic and wildlife, for mpox and monitoring suspected and confirmed animal cases",Epidemiology,CDC,Domestic,Ongoing,2023 Q1: Complete laboratory testing,Ongoing throughout the outbreak,"Animals, both domestic and wildlife, with clinical signs of mpox are sampled by state and local jurisdictions. CDC experts are available to support jurisdictions in collecting animal samples and conducting One Health investigations upon invitation. Animal samples are submitted to CDC for diagnostics. This line of study will support our understanding of the potential of mpox to spread zoonotically in the United States, a circumstance that could prolong the outbreak and diminish the likelihood of eradicating the infection.",
Human-Animal Environment Study,Assessing mpox infections in animals associated with human cases,Epidemiology,CDC,Domestic,Ongoing,"2023 Q1-Q2:
Complete study; publish results",Ongoing during the outbreak,"CDC is leading a One Health study to assess mpox infections in animals in households with human mpox cases.  Animals, including pets, with and without clinical signs are sampled from the homes of people isolating with mpox. Laboratory diagnostics for animal and environmental samples are conducted at CDC and results are provided to jurisdictions. One Health teams of local, state, and federal partners discuss next steps and recommendations to protect health. A questionnaire is administered to examine close contact between humans and animals, assess the environment and animal husbandry, and to assess risk factors for animal infections. This study will help identify susceptible animal species in the US and will help prevent the establishment of new animal reservoirs for mpox. 

This line of study will support our understanding of the potential of Mpox to spread zoonotically in the United States, a circumstance that could prolong the outbreak and diminish the likelihood of eradicating the infection.

Manuscript has been written and completed CDC clearance.  Will be submitted for publication in 23 Q2",
Human-Animal Environment Study,Ecological studies,Epidemiology,NIH/NIAID,International: Republic of Congo (RoC); Ghana,Ongoing,,,NIH has been conducting ecological studies in Africa to understand spillover events. Data from this study will inform efforts to prevent and control future spillover of mpox in Western and Central Africa.,
Serologic assay development and serosurvey,Developing high throughput serologic assays to understand magnitude of spillover in African sites,Epidemiology,NIH/NIAID,"International: Mali, Ghana, Republic of the Congo and Cambodia",Ongoing,"2022 Q4 team to Ghana
Manuscript published
Fischer RJ, Gallogly S, Evaluation of Five Buffers for Inactivation of Mpox Virus and Feasibility of Virus Detection Using the Panther Fusion® Open Access System. Viruses. 2022 Oct 10;14(10):2227. doi: 10.3390/v14102227. PMID: 36298782; PMCID: PMC9610623.",,"The assays under development will allow us to determine a history of mpox infection in people, and to distinguish between individuals who have been infected with a poxvirus and individuals who were vaccinated against smallpox. Will collaborate with Orasure on a rapid test. Data from this study will inform more accurate estimates of the prevalence of mpox spillover and transmission in Western and Central Africa, and will lead to the development of a diagnostic tool that could be used in future clinical studies of the immune response to mpox infection and vaccination.",
Clinical Specimen Study,Novel specimen validation,Epidemiology,CDC,Domestic,Complete. Manuscript has been published,"2023 Q1: Publish results for visit 1

2023 Q3: Publish results for subsequence visits",2023 Q1,"This is a study in collaboration with DC Health department to evaluate the presence of mpox DNA in throat, rectal, and blood specimens collected from individuals at risk for mpox but without lesions to inform potential use in diagnostic testing. This study will accelerate early, accurate detection of infection, and help to prevent ongoing transmission by potentially but expanding the range of specimen types that are approved for diagnostic purposes. The study has concluded, and results published.  Another manuscript is currently being drafted. .",https://academic.oup.com/cid/advance-article/doi/10.1093/cid/ciad145/7076896
Molecular Epidemiology Study,Genomic surveillance to monitor viral evolution and antiviral resistance,Epidemiology,CDC,Domestic,Ongoing,"2022 Q3: publish 100 US mpox virus genomes

2022 Q4: published article",Ongoing,"This study will monitor mpox virus lineages and mutations, especially tracking changes that could affect diagnostic testing or effectiveness of treatment (TPOXX). This study involves sequencing mpox virus from confirmed cases at CDC, monitoring mpox virus sequences produced by other groups found in public databases, and consulting with academic and state partners on mpox virus sequencing approaches, interpretations, and findings. If sequence changes are observed in the viral target of TPOXX, CDC will conduct laboratory testing to confirm the viral isolate remains sensitive to the therapeutic. This study will track genomic mutations that could signal changes in transmission or susceptibility to TPOXX, which would then impact mitigation efforts.",https://doi.org/10.1126/science.add4153
Serological Assay Development,Multiplex Serological Assay to Distinguish mpox from other orthopoxviruses (CREID Network Supported),Epidemiology,NIH/NIAID,Domestic and International,Ongoing,Preliminary specificity for mpox appears to be 85%,2023 Q2,"Scientists from the Centers for Research in Emerging Infectious Diseases (CREID) Network are developing multiplex serologic assays that can distinguish between mpox and other common orthopoxviruses for use with both animal and human specimens. Pending the results, the assay will be made available to the scientific community to facilitate seroprevalence studies in endemic regions.",
Observational Study,"Seroprevalence and Risk Factors of Mpox virus Infection Among Adults in Nigeria:  A Cross-sectional Exploration of the Implication for Mpox Epidemiology, Transmission, and Surveillance in Africa",Epidemiology,DHA/WRAIR,International: West Africa,Ongoing,"2023 Q1: Complete study documentation and
IRB submission and approval, validate MSD serology assay",2023 Q3,The prospective seroprevalence and risk factor mpox virus infection study aims to fill gaps in in resolving the key parameters of human vulnerability to emerging infectious diseases; from clinical diagnosis and molecular detection of mpox in humans to evaluating potential zoonotic reservoirs and transmission routes. Collected samples will serve as a starting point to better understand biomarkers of infections and transmission.,
Observational Study,Mpox disease burden and associated predictors in international at-risk populations,Epidemiology,DHA/WRAIR,"International: West Africa, Thailand, and Europe",Ongoing,"2023 Q1: Complete study documentation and
IRB submission and approval, validate MSD serology assay",2023 Q3,"This prospective and retrospective study will characterization of mpox infection, epidemiology, transmission, and clinical presentation in context of global outbreaks; leverage enhanced diagnostic approaches to inform knowledge products for prevention / risk mitigation strategies.",
Mpox serological assay development,Develop a mpox virus-specific serologic assay,Epidemiology,CDC,USA,Ongoing,Beginning Q4 2022,TBD,"Development of a mpox virus specific serology assay that can be universally used for both humans and animals will allow for the identification of infections following recovery from disease.  This will aid in the identification of animals that have been previously infected with mpox virus and provide data about which species may serve as hosts. Partner: CDC Division of Scientific Resources, USDA. The study is ongoing.",
Analysis of the VA Patient Population Affected by Mpox,Mpox in Veterans Affairs Healthcare System,Epidemiology,VA,Domestic,Planning,"1) Creating research team  

2) designing study – December 31, 2022",2023 Q1,"Description and comparison of unique populations affected by mpox:  1) test positive and treated 2) test positive and untreated 3) test negatives 4) test negatives and re-tested positively 3) indeterminant tests 4) inconclusive tests 5) presented for symptoms but untested. Outcomes include laboratory markers, genome wide sequencing, viral lineage/drug resistance/phylogenetics risk characteristics, clinical course, sequelae of illness. This study will provide information about test performance and illness course, but also help us understand characteristics of individuals presenting for testing to inform testing strategies, including timing for retesting and the value of testing with exposure but without symptoms. An abstract was submitted for presentation at the Council of State and Territorial Epidemiologists 2023 Annual Conference, titled “Epidemiology of the Mpox Outbreak in the Veterans Health Administration (VHA), 2022”.",
Biorepository System,Veterans Affairs Science and Health Initiative to Combat Infectious and Emerging Life-Threatening Diseases (VA SHIELD),Epidemiology,VA/VHA,Domestic,Initiated,"Specimens collected; Specimens used for research – December 31, 2022",Ongoing part of VA’s research pandemic preparedness actions,"VA SHIELD collects de-identified biological samples from U.S. Veterans affected by emerging life-threatening health conditions. Associated clinical and demographic information is maintained in a data repository, to help correlate samples and experimental findings with patient demographics, clinical experience and management, vaccinations, and comorbidities. Specimens are available to investigators within and outside VA via an efficient, secure, vetted distribution system. The number of collected specimens now totals over 40,000 (most of the specimens are COVID positive NP swabs, MPX swabs, plasma, and serum).",https://www.research.va.gov/programs/shield/about.cfm
Monitoring International Mpox Infections,No formal research protocol – monitoring the epidemic among people living with HIV/AIDS to determine whether additional support is needed,Epidemiology,DOS/S/GAC,"International: Countries with PEPFAR programs (Angola, Benin, Botswana, Brazil, Burkina Faso, Burma, Burundi, Cambodia, Cameroon, Cote d’Ivoire, Dominican Republic, DRC, El Salvador, Eswatini, Ethiopia, Ghana, Guatemala, Guyana, Haiti, Honduras, India, Indonesia, Jamaica, Kenya, Kyrgyz Republic, Kazakhstan, Laos, Lesotho, Liberia, Malawi, Mali, Mozambique, Namibia, Nepal, Nicaragua, Nigeria, Panama, Papua New Guinea, Philippines, Rwanda, Senegal, Sierra Leone, South Africa, South Sudan, Tajikistan, Tanzania, Thailand, Togo, Trinidad and Tobago, Uganda, Ukraine, Vietnam, Zambia, Zimbabwe)",Ongoing,None,TBD,"Through communication with U.S. Government in-country staff, the office of the Global AIDS Coordinator is monitoring the impact of the mpox virus outbreak in endemic and non-endemic countries on President’s Emergency Plan for AIDS Relief (PEPFAR) beneficiaries and programs.","https://www.state.gov/statement-from-u-s-global-aids-coordinator-ambassador-dr-john-nkengasong-on-use-of-the-pepfar-platform-for-monkeypox-response/#:~:text=As%20part%20of%20the%20U.S.,prevent%20and%20respond%20to%20monkeypox."
Computational studies of phylogeny and predicting structures of all the monkey pox proteins,Computational studies of monkey pox protein and emerging variants,Epidemiology,DOE/NIAID,Domestic,Ongoing,,,"Argonne (in a collaboration with University of Chicago, University of Virginia and J. Craig Venter Institute) is conducting mpox studies for an NIAID-supported center Bioinformatics Resource Center [BV-BRC https://www.bv-brc.org] that includes studies of phylogeny, predicting structures of all the mpox proteins (~180) and assessing the proteins on a therapeutics pipeline.  They are also tracking all the new variants and providing summary reports to NIAID leadership.",
Mpox Virus detection,Sequencing monkey pox virus from Chicago area wastewater,Epidemiology,DOE,Domestic,Feasibility studies completed,,,Scientists at Argonne are sequencing mpox from wastewater samples collected in the Chicago area to assess whether sequencing will be more consistent and more sensitive than some of the current qPCR/dPCR methods that have produced mixed results.,
Evolution of Mpox,Assessment of human enzyme cAPOBEC3 impacts on driving mpox evolution,Epidemiology,DOE,Domestic,Ongoing,,,"Scientists at Los Alamos recognized a very unusual pattern of mutation that is operative in HIV-1 evolution that is driving mpox evolution in the outbreak (and during its initial spread in 2017). The mutations in the outbreak viruses are driven by human enzyme cAPOBEC3, which is part of the innate immune system.  Other unusual mutation patterns are being defined, along with strategies for dealing with these issues for multiple alignments and studying mpox’s emergence in Nigeria. Computational modeling is being used to study the dynamics of distinctive variants to track evidence for evolutionary selection and to understand if the variants have implications for epidemic forecasting.  This work will enable a better understanding of mpox virus evolution.",
Virus genome sequencing,Challenges in sequencing and assembling mpox viral genome,Epidemiology,DOE,Domestic,Ongoing,,,"Scientists at Los Alamos are advising the CDC genomics group on how to best overcome some of the sequencing and assembly challenges that this large viral genome has compared with SARS-CoV-2. “Multiple lineages of monkeypox virus detected in the United States, 2021-2022.”, joint with CDC, Science. 2022 Nov 4;378(6619):560-565. doi: 10.1126/science.add4153. Epub 2022 Oct 20. PMID: 36264825.",
Molecular Therapeutics,Computational design of potential pan-orthopox anti-viral,Therapeutics,DOE,Domestic,Planned,,,Lawrence Livermore is conducting studies as part of the DoD/JPEO Generative Unconstrained Intelligent Drug Engineering (GUIDE) program to establish the feasibility of undertaking a computational design campaign to develop a pan-orthopoxvirus therapeutic/prophylactic antibody.,
Animal reservoirs,Investigation of animal reservoirs,Epidemiology,CDC,"Cameroon, Nigeria",Ongoing,"2023 Q3,4: Laboratory analysis of specimens",2023 Q3,"This study assesses the prevalence of antibody-positive blood samples collected from animals in forest areas where cases of mpox have been reported. Activities include collecting tissue and swab samples from small mammals and testing for presence of mpox virus in high-risk areas. These activities will further our understanding of natural transmission patterns and sources of mpox virus, aiding our ability to stem future introductions into the United States and to assist endemic countries in minimizing the impact of the disease in their countries.",
Passive zoonotic disease surveillance,Ongoing Passive Surveillance of Sick or Dead Wildlife Species,Epidemiology,FWS)/NWRS,USA,Ongoing,N/A,N/A,"There is ongoing passive surveillance for sick and dead wildlife species on national wildlife refuges for various zoonotic disease agents (e.g., highly pathogenic avian influenza (HPAI), tularemia, anthrax, plague, rabies, etc.). The FWS Wildlife Health office within the NWRS receive notifications about sick or dead wildlife from FWS refuge personnel. FWS refuge staff may also be in communication with local and/or state public health agencies, state public health veterinarians, etc., along with the FWS Wildlife Health office. The Wildlife Health office staff discuss pertinent biosafety and biosecurity measures to implement based on the specific report and proper sample collection and shipping procedures if samples will be sent to a veterinary diagnostic laboratory, the National Wildlife Health Center, or another appropriate laboratory depending on the sample(s) submitted for diagnostic testing. There is no current active disease surveillance in place for mpox virus in wildlife on the national wildlife refuges.",
Human-animal interface study,Investigation of zoonotic risk factors among mpox cases in Nigeria,Epidemiology,CDC,Nigeria,Planned (normal long-standing program activity),FY23,"September 30, 2023 (with option to extend 1 year)","This project will use mixed methods (qualitative and quantitative) interviews to examine mpox risk factors at the human-animal interface for human mpox cases. This will provide missing data about how people in Nigeria are being exposed to infected animals. Partners: Penn State, Nigeria Centre for Disease Control, National Veterinary Research Institute",
Mpox virus ecology study,Assessing the ecological aspects of mpox virus in Nigeria: building capacity for field and lab-based investigations,Epidemiology,CDC,Nigeria,Ongoing (normal long-standing program activity),,TBD,"A One Health Team has been trained to capture, sample, and test animals for mpox virus infections. The team continues to collect animal samples for lab analysis. Study will provide information about which types of animals are naturally infected with mpox virus in the environment. Partners include: Nigeria Centre for Disease Control, National Veterinary Research Institute, Federal Ministry of Agriculture and Rural Development, African Field Epidemiology Network.",
Human-animal interface/value chain risk study,Examining the human-animal interface: assessing mpox risk along the wild game meat value chain,Epidemiology,CDC,Democratic Republic of the Congo,Ongoing (normal long-standing program activity),2nd field session Q1 2023,TBD,"Examining the human-animal interface in rural DRC where people regularly hunt and consume small mammals as an essential protein source. This project will generate quantifiable data on characteristics of hunters, analysis of hunting effort, small mammal species captured, and the disposition of those animals.  These data will be analyzed spatially and examined for risk factors for primary zoonotic transmission of mpox virus and other zoonotic pathogens into human populations. Study will provide information about how human behaviors may increase the risk of mpox virus transmission from animals to humans. Partners include: University of Kinshasa, Kinshasa School of Public Health.",
Ecology of suspected reservoirs,Studies to examine the ecology of suspected mpox reservoirs,Epidemiology,CDC,Democratic Republic of the Congo,Ongoing (normal long-standing program activity),Field session Q1 2023,TBD,"The current study uses camera traps to assess the activity patterns and relative abundance of suspected mpox reservoirs in disturbed and undisturbed environments to examine potential mpox risk at the human-animal interface in these habitats. This will provide information on how animal behaviors may increase the risk of mpox virus transmission from animals to humans. Partners include: University of Kinshasa, Kinshasa School of Public Health.",
Mpox virus  ecology study,Investigating potential small mammal reservoirs in Sierra Leone,Epidemiology,CDC,Sierra Leone,Ongoing (normal long-standing program activity),,TBD,"A team at the University of Njala has been trained to capture, sample, and test animals for mpox virus infections. The team continues to collect animal samples for lab analysis. Study will provide information about which animals are naturally infected with mpox virus in the environment. Partner: University of Njala.",
Mpox virus  ecology study and outbreak response,Assessing mpox virus prevalence in small mammals and outbreak response,Epidemiology,CDC,Cameroon,Ongoing,,2024,"A Team from the University of Douala has been trained to capture, sample, and test animals for mpox virus infections. The team continues to collect animal samples for lab analysis during outbreak response efforts. This will provide information about which animals may be transmitting mpox virus to humans. Defense Threat Reduction Agency (DTRA) funded, Partners include: Ministry of Public Health, Centre Pasteur in Cameroon, University of Doula, National Veterinary Laboratory",
"Mpox virus ecology studies, capacity building, viral sequencies, modeling, human surveillance",Mpox Threat Reduction Network (TRN): Decreasing the threat of mpox emergence and spread in West and Central Africa,Epidemiology,DTRA/CDC,"International: Nigeria, Cameroon, Democratic Republic of the Congo, Gabon",Ongoing,,2028,"This study is a wide-ranging project to reduce mpox cases in endemic countries.  A large part of the project will assess potential animal reservoirs and examine the ecological aspects of mpox virus though research and capacity building. The project will provide information about animals involved in the transmission of mpox virus to humans, but also about how human and animal behaviors may increase the risk of mpox virus transmission from animals to humans. Defense Threat Reduction Agency (DTRA) funded. Partners include: Nigeria Centre for Disease Control (NCDC), National Veterinary Research Institute in Nigeria (NVRI), African Field Epidemiology Network (AFENET), Centre Pasteur in Cameroon (CPC), University of Doula (UDLA), National Veterinary Laboratory (LANAVET), National Biomedical Research Institute in Kinshasa (INRB), International Center of Medical Research of Franceville, Gabon (CIRMF).",
